{
  "category": "healthcare",
  "content": "**Linia fierbinte**(022)866-966 / (022)471-790\n\nÎn cadrul discuției, medicii și asistenții medicului de familie au fost sensibilizați cu privire la importanța vaccinării, rata de acoperire  vaccinală a copiilor pe parcursul ultimilor ani comparativ cu țările UE, prevederile Programului Național de Imunizari. În rol important  la acest capitol, revine înregistrării/omologării corecte în cadrul **Sistemului Informațional Registrul Electronic Național de Vaccinare (RENV)**  a datelor despre imunizarea populației.\n",
  "content_sha256": "cf5f14d6f37edb2dce91c8844017dfa0773583d10836a979ead5a8069c812de4",
  "document_date": null,
  "document_id": "doc_56dce7fdcf7cc6989825",
  "document_type": "html",
  "effective_from": null,
  "effective_to": null,
  "extraction": {
    "method": "trafilatura",
    "page_count": null,
    "quality": 1.0,
    "raw_content_sha256": "cd46de998b87f14f302c25de1900d859a47f9f3d91d85bf450be9b9f0456adc2",
    "raw_path": "data/raw/amt-ciocana/cd46de998b87f14f302c25de1900d859a47f9f3d91d85bf450be9b9f0456adc2.html",
    "structure_path": null
  },
  "language": "ro",
  "retrieved_at": "2026-09-25T17:11:11.739526+00:00",
  "source_url": "https://amt-ciocana.md/comunicate/05-03-2026-%C8%99edin%C8%9Ba-lucr%C4%83torilor-medicali-cu-tematica-Realizarea-Programului-Na%C8%9Bional-de-Imuniz%C4%83ri-realiz%C4%83ri,-provoc%C4%83ri,-perspective.html",
  "title": "https://amt-ciocana.md/comunicate/05-03-2026-%C8%99edin%C8%9Ba-lucr%C4%83torilor-medicali-cu-tematica-Realizarea-Programului-Na%C8%9Bional-de-Imuniz%C4%83ri-realiz%C4%83ri,-provoc%C4%83ri,-perspective.html",
  "version_id": "ver_56dce7fd_cf5f14d6f37e"
}
