{
  "category": "education",
  "content": "# Oferta educațională „Curcubeul Estival” 2026\n\n###### Oferta educațională pentru luna iunie în perioada 02.06 - 25.06.2026 pentru elevii doritori să-și dezvolte abilitățile artistice și să-și organizeze activ timpul liber include muzică, teatru, folclor, coregrafie, arte plastice și arte decorative. Doritorii (5-21 ani) se pot înscrie în activitatea cercurilor de diferite profiluri de artă.\n\n##### Opțiune preț\n\nGratuit\n\n##### Modalitate de desfășurare\n\nCu prezența fizică\n\n##### Orar\n\nLuni-vineri 09:00-12:35\n\n##### Vârsta\n\n5 ani - 21 ani\n\n##### Adresa\n\nStr. Braniștii 5\n\n#### Instituția:\n\n###### Centrul de Activitate Extrașcolară ,,Curcubeul”\n\n##### Email\n\ncaecurcubeul@gmail.com\n\n##### Telefon\n\n022 440 050\n\n[Link de înregistrare](https://www.facebook.com/curcubeulchisinau)\n",
  "content_sha256": "0df7f861b515099afa6a29aece04bdc6868d5831af2213201449badfe8b7c5ff",
  "document_date": null,
  "document_id": "doc_1bda58ad598b2970c6f1",
  "document_type": "html",
  "effective_from": null,
  "effective_to": null,
  "extraction": {
    "method": "dom-markdown",
    "page_count": null,
    "quality": 1.0,
    "raw_content_sha256": "c32562ae0019efcb5f013d410186da8c81552767a884dd51de704d1953f4a071",
    "raw_path": "data/raw/extrascolar-activities/c32562ae0019efcb5f013d410186da8c81552767a884dd51de704d1953f4a071.html",
    "structure_path": null
  },
  "language": "ro",
  "retrieved_at": "2026-09-25T22:05:34.566549+00:00",
  "source_url": "https://extrascolar.md/activity/oferta-educationala-curcubeul-estival-2026307",
  "title": "Oferta educațională „Curcubeul Estival” 2026",
  "version_id": "ver_1bda58ad_0df7f861b515"
}
