{
  "category": "other_public_services",
  "content": "Pentru consultaţii referitor la avizele de plată Vă puteţi adresa la numere de **telefon**: (022) 85-42-52, (022) 85-42-54\n\n                                    sau la sediul Î.M.Infocom pe **adresa**: mun.Chişinău, str.Bucureşti 68,\n\n                                    de la data de **14** până la data de **27**, de **luni** până **vineri**, orele **08:00 - 16:00** (pauza de masa **12:00 - 13:00**).\n\n                                    **Publicitate**: (069) 045-132\n\n                                    **Informaţii pe serviciul \"Radio\"**: (022) 876-366 (inclusiv privind deconectarea serviciului)\n\n                                    **Informaţii pe serviciul \"Antena TV\"**: (022) 719-459, (022) 719-446 (inclusiv privind deconectarea serviciului)\n\n                                    sau pe adresa: mun.Chişinău, str. Piaţa Unirii 3 (farmacia \"Flacara\").\n\n                                    **Program de lucru**: Marţi şi Vineri, de la 09:00-14:00\n",
  "content_sha256": "97e8ef9e023b4253ce1df45023170c44332fa8fd4d84cd8ce733a08d1c4a8be1",
  "document_date": null,
  "document_id": "doc_9ecb18afd249c662db2a",
  "document_type": "html",
  "effective_from": null,
  "effective_to": null,
  "extraction": {
    "method": "trafilatura",
    "page_count": null,
    "quality": 1.0,
    "raw_content_sha256": "115dc277ba48149ab899b672b2e4d347618ec8918e0c2aa5604ccc243f114850",
    "raw_path": "data/raw/infocom/115dc277ba48149ab899b672b2e4d347618ec8918e0c2aa5604ccc243f114850.html",
    "structure_path": null
  },
  "language": "ro",
  "retrieved_at": "2026-09-25T17:06:45.078635+00:00",
  "source_url": "http://www.infocom.md/pagina/contact.html",
  "title": "Î.M. Infocom - Contacte",
  "version_id": "ver_9ecb18af_97e8ef9e023b"
}
