{
  "category": "district_administration",
  "content": "Pretura sectorului Botanica a inițiat procedura de stabilire a relațiilor de cooperare și înfrățire cu Primăria Sectorului 3 București. Consolidarea relațiilor de cooperare și înfrățire sunt stabilite în baza Protocolul de Înfrățire încheiat între municipiul București și municipiul Chișinău în anul 1999, dar și Programul de cooperare București - Chișinău, semnat la 14 februarie 2018.\n\nSubiectul inițierii relațiilor de cooperare și înfrățire a fost discutat astăzi la București, de pretorul sectorului Botanica, dna Diana Guba și primarul Sectorului 3, dl Robert Sorin Negoiță.\n\nPretorul sectorului Botanica și-a exprimat convingerea că semnarea Acordului de înfrățire cu Primăria Sectorului 3 va consolida relația de cooperare dintre cele două municipalități. „Apreciem faptul că Primăria Sectorului 3 a manifestat deschidere pentru a trece la o altă etapă de dezvoltare a relațiilor bilaterale dintre Chișinău și București\", a precizat Diana Guba.\n",
  "content_sha256": "6bf63f70baa3b21488d1c77c22edbf8e4113ebb8101e850310a3e896da8850d1",
  "document_date": null,
  "document_id": "doc_7e367a67de1fc19cae32",
  "document_type": "html",
  "effective_from": null,
  "effective_to": null,
  "extraction": {
    "method": "trafilatura",
    "page_count": null,
    "quality": 1.0,
    "raw_content_sha256": "6c7a8831191b4e9847e475d5c0830896828c30bd045df852f8f026f09b53b264",
    "raw_path": "data/raw/district-botanica/6c7a8831191b4e9847e475d5c0830896828c30bd045df852f8f026f09b53b264.html",
    "structure_path": null
  },
  "language": "ro",
  "retrieved_at": "2026-09-25T17:44:59.204231+00:00",
  "source_url": "https://botanica.md/%C3%8Entre-pretura-sectorului-botanica-%C8%99i-prim%C4%83ria-sectorului-3-bucure%C8%99ti-au-fost-ini%C8%9Biate-rela%C8%9Bii-de-colaborare",
  "title": "Între Pretura sectorului Botanica și Primăria Sectorului 3 București au fost Inițiate relații de colaborare",
  "version_id": "ver_7e367a67_6bf63f70baa3"
}
