{
  "category": "district_administration",
  "content": "# Lucrări din domeniul locativ - comunal din sectorul Botanica...\n\n## Lucrări din domeniul locativ - comunal din sectorul Botanica (20.11-27.11.2020 ) ‼️Pe parcursul săptămânii de către serviciile specializate din sector au fost efectuate următoarele lucrări:\n\nLucrări din domeniul locativ - comunal din sectorul Botanica (20.11-27.11.2020 )\n\n‼️Pe parcursul săptămânii de către serviciile specializate din sector au fost efectuate următoarele lucrări:\n",
  "content_sha256": "29c9574a060bbdd1b506c2e5cc414f9a2d59d354bd58557af6f36c47560a9951",
  "document_date": null,
  "document_id": "doc_f2adcd89dd95806507ba",
  "document_type": "html",
  "effective_from": null,
  "effective_to": null,
  "extraction": {
    "method": "trafilatura",
    "page_count": null,
    "quality": 1.0,
    "raw_content_sha256": "de50ae2cc9f527c2cef8c86dc552764204d12120dc81dc7cd8e492bcd421e559",
    "raw_path": "data/raw/district-botanica/de50ae2cc9f527c2cef8c86dc552764204d12120dc81dc7cd8e492bcd421e559.html",
    "structure_path": null
  },
  "language": "ro",
  "retrieved_at": "2026-09-25T18:10:00+00:00",
  "source_url": "https://botanica.md/lucrari-din-domeniul-locativ-comunal-din-sectorul-botanica",
  "title": "Lucrări din domeniul locativ - comunal din sectorul Botanica...",
  "version_id": "ver_f2adcd89_29c9574a060b"
}
