{
  "category": "education",
  "content": "# Cluburi de interes pentru elevi: lectură, gătit, teatru, dezbateri, sport, limba engleză\n\n###### Cluburile de Interes organizate de Centrul Municipal de Tineret au scopul de a fortifica timpul liber și cunoștințele celor ce se implică, dintre care poți face parte și tu! Îți prezentăm cluburile și zilele în care acestea se întâlnesc: 🔻Clubul de lectură - miercuri, ora 16:00 🔻Clubul de gătit - luni, ora 16:00 🔻Clubul de teatru - joi, ora 16:00 🔻Clubul de dezbateri - sâmbătă, ora 16:00 🔻Clubul de jocuri intelectuale - vineri, ora 17:00 🔻Clubul de sport - duminică, ora 15:00 🔻Clubul de fotografie - vineri, ora 15:00 🔻Clubul de educație juridică - marți, ora 17:00 🔻Clubul de educație financiară - sâmbătă, ora 12:00 🔻Clubul de engleză - joi, ora 15:30\n\n##### Opțiune preț\n\nGratuit\n\n##### Modalitate de desfășurare\n\nCu prezența fizică\n\n##### Orar\n\nLuni - Vineri\n\n##### Vârsta\n\n14 ani - 35 ani\n\n##### Adresa\n\nStr. Petru Zadnipru 3/2\n\n#### Instituția:\n\n###### Centrul Municipal de Tineret Chișinău\n\n##### Email\n\ncentru.chisinau@gmail.com\n\n##### Telefon\n\n022 482 420\n\n[Link de înregistrare](https://www.facebook.com/CentrulMunicipalTineretChisinau/posts/pfbid02sFDwVViTtLpm7DSeQjQYx9E8WHgJgY6kyRymchUYfKM2owHHeQbJrjSTd66WWQTAl)\n",
  "content_sha256": "3d4670fc1fd45ad98ce8223bdfc55ea2a8daf9650b8b3e119e55d72442ccd456",
  "document_date": null,
  "document_id": "doc_d25b14803c84bf325e33",
  "document_type": "html",
  "effective_from": null,
  "effective_to": null,
  "extraction": {
    "method": "dom-markdown",
    "page_count": null,
    "quality": 1.0,
    "raw_content_sha256": "6d9f7433f994b67a5a1f682b480e5b896ae13a1dd21f39aca05c08bf2479af8a",
    "raw_path": "data/raw/extrascolar-activities/6d9f7433f994b67a5a1f682b480e5b896ae13a1dd21f39aca05c08bf2479af8a.html",
    "structure_path": null
  },
  "language": "ro",
  "retrieved_at": "2026-09-25T22:03:06.077455+00:00",
  "source_url": "https://extrascolar.md/activity/cluburi-de-interes-pentru-elevi-lectura-gatit-teatru-dezbateri-sport-limba-engleza55",
  "title": "Cluburi de interes pentru elevi: lectură, gătit, teatru, dezbateri, sport, limba engleză",
  "version_id": "ver_d25b1480_3d4670fc1fd4"
}
