{
  "category": "education",
  "content": "# Cercuri extrașcolare\n\n###### Dezvoltarea competențelor motorice, dezvoltarea spiritului creativ, dezvoltarea talentelor, echipă de cadre didactice profesionistă.\n\n##### Opțiune preț\n\nGratuit\n\n##### Modalitate de desfășurare\n\nCu prezență fizică\n\n##### Orar\n\nLuni - Duminica\n\n##### Vârsta\n\n7 ani - 16 ani\n\n##### Adresa\n\nCiocana, s. Budești, str. Chișinău, 115\n\n#### Instituția:\n\n###### Centrul pentru Copii și Tineret ”Udo Jurgens”\n\n##### Email\n\nmaricicaproca@gmail.com\n\n##### Telefon\n\n+37368539828\n\n[Link de înregistrare](https://www.facebook.com/cct.udojurgens.9)\n",
  "content_sha256": "31ed668d6286c469dee8cf2ff292dce659cb4c74d3117074b17fa824b5377fe8",
  "document_date": null,
  "document_id": "doc_a6582d4a2665ec57ab29",
  "document_type": "html",
  "effective_from": null,
  "effective_to": null,
  "extraction": {
    "method": "dom-markdown",
    "page_count": null,
    "quality": 1.0,
    "raw_content_sha256": "f766246e71181e58055636d3b11eef40da596806108f03399bc1b21318d32993",
    "raw_path": "data/raw/extrascolar-activities/f766246e71181e58055636d3b11eef40da596806108f03399bc1b21318d32993.html",
    "structure_path": null
  },
  "language": "ro",
  "retrieved_at": "2026-09-25T22:02:53.675265+00:00",
  "source_url": "https://extrascolar.md/activity/cercuri-extrascolare28",
  "title": "Cercuri extrașcolare",
  "version_id": "ver_a6582d4a_31ed668d6286"
}
