{
  "category": "district_administration",
  "content": "# ‼️Ședință comună privind dezvoltarea infrastructurii curților de bloc\n\n✅Astăzi, 13 noiembrie 2024, a avut loc o ședință comună între Viceprimarul capitalei, Ilie Ceban, pretorul sectorului Botanica, Diana Guba, Direcția Generală Mobilitate Urbană și Direcția Generală Locativ - Comunală și Amenajare, pentru a discuta despre dezvoltarea infrastructurii curților de bloc din zona str. N. Titulescu, 2-4.\n\n❇️În cadrul întâlnirii, au fost abordate proiectele de modernizare și reabilit...are a curților de bloc, cu scopul de a îmbunătăți condițiile de trai ale locatarilor și de a optimiza circulația pietonală și accesul în zonă. De asemenea, au fost stabilite pașii necesari pentru implementarea unor soluții eficiente în vederea creării unui mediu urban mai plăcut și funcțional.\n\n☘️Administrația locală rămâne dedicată creării unui mediu urban mai accesibil și mai prietenos pentru toți cetățenii!❗️\n",
  "content_sha256": "d8b8d690e16aabcb121cf72fe2f67ee28c2e9e018336f3ae1d9c0f8d466568b3",
  "document_date": null,
  "document_id": "doc_994873725e9d7398b0a9",
  "document_type": "html",
  "effective_from": null,
  "effective_to": null,
  "extraction": {
    "method": "trafilatura",
    "page_count": null,
    "quality": 1.0,
    "raw_content_sha256": "1c7c5be0d44b159352773c01e5d8647c043125f2141cf9b3dd23183b7700ff78",
    "raw_path": "data/raw/district-botanica/1c7c5be0d44b159352773c01e5d8647c043125f2141cf9b3dd23183b7700ff78.html",
    "structure_path": null
  },
  "language": "ro",
  "retrieved_at": "2026-09-25T17:38:18.060559+00:00",
  "source_url": "https://botanica.md/749",
  "title": "‼️Ședință comună privind dezvoltarea infrastructurii curților de bloc",
  "version_id": "ver_99487372_d8b8d690e16a"
}
