{
  "category": "district_administration",
  "content": "Astăzi, 18.06.2021, în conformitate cu dispoziția Pretorului sectorului Botanica, dna Diana GUBA au fost demontate și evacuate o gheretă din str. Hristo Botev, 3/1 și o tonetă din str. Calea Basarabiei, 38 în lipsa actelor permisive.\n\nLucrările au fost executate de către angajații Întreprinderii Municipale pentru Servicii Locative Botanica sub supravegherea Secției social-economice.\n\nOrdinea publică a fost asigurată de către Inspectoratul de Poliție Botanica.\n",
  "content_sha256": "99ac52774dfde877d4b8bda11c11a55076521a37d89c343e74d5ba21b3f4e905",
  "document_date": null,
  "document_id": "doc_213795dd04daddf5d57c",
  "document_type": "html",
  "effective_from": null,
  "effective_to": null,
  "extraction": {
    "method": "trafilatura",
    "page_count": null,
    "quality": 1.0,
    "raw_content_sha256": "b647259059115d253690f89584dcefa40382439692f050f69be542cf6176f0e8",
    "raw_path": "data/raw/district-botanica/b647259059115d253690f89584dcefa40382439692f050f69be542cf6176f0e8.html",
    "structure_path": null
  },
  "language": "ro",
  "retrieved_at": "2026-09-25T18:10:00+00:00",
  "source_url": "https://botanica.md/astazi-au-fost-demontate-o-ghereta-si-o-toneta-in-sectorul-botanica",
  "title": "Astăzi au fost demontate o gheretă și o tonetă în sectorul Botanica",
  "version_id": "ver_213795dd_99ac52774dfd"
}
