{
  "category": "education",
  "content": "# Programul de vară „Micii creativi”\n\n###### Programul de vară include activități de pictură, grafică, quilling, arta vorbirii, studierea ținutului natal și origami. Luni-vineri, Schimbul I: 9.00-12.00; Schimbul II: 13.00-16.00\n\n##### Opțiune preț\n\nGratuit\n\n##### Modalitate de desfășurare\n\nCu prezența fizică\n\n##### Orar\n\nLuni - Vineri\n\n##### Vârsta\n\n7 ani - 12 ani\n\n##### Adresa\n\nstr. Independenței 9/2\n\n#### Instituția:\n\n###### Centrul Comunitar pentru Copii și Tineri ,,Satelit”\n\n##### Email\n\ngrozavuveronica77@gmail.com\n\n##### Telefon\n\n079770822\n\n[Link de înregistrare](https://extrascolar.md/activity/www.facebook.com/CentrulComunitarpentruCopiiTineriSatelitChișinău)\n",
  "content_sha256": "1409d7054c226f31339a7091e1d92546d22787b06802af1ebfb04f4cd87f66bb",
  "document_date": null,
  "document_id": "doc_35a2e550ed18d871ec94",
  "document_type": "html",
  "effective_from": null,
  "effective_to": null,
  "extraction": {
    "method": "dom-markdown",
    "page_count": null,
    "quality": 1.0,
    "raw_content_sha256": "5206478355149a59af6f955a641d002f9485d84995cf5caef35b882624b8438b",
    "raw_path": "data/raw/extrascolar-activities/5206478355149a59af6f955a641d002f9485d84995cf5caef35b882624b8438b.html",
    "structure_path": null
  },
  "language": "ro",
  "retrieved_at": "2026-09-25T22:03:32.165335+00:00",
  "source_url": "https://extrascolar.md/activity/programul-de-vara-micii-creativi86",
  "title": "Programul de vară „Micii creativi”",
  "version_id": "ver_35a2e550_1409d7054c22"
}
