{
  "category": "district_administration",
  "content": "# Raport\n\n## Raport\n\nRAPORT cu privire la implementarea Planului de integritate al Preturii sectorului Botanica, perioada de raport: martie 2025 - martie 2026.\n\nJoin our subscribers list to get the latest news, updates and special offers directly in your inbox\n",
  "content_sha256": "0ef19071ed144c75387c7c16c04b8dcd6b93da70476b32ec54073638d90a3386",
  "document_date": null,
  "document_id": "doc_330d31db47c075cd8ab8",
  "document_type": "html",
  "effective_from": null,
  "effective_to": null,
  "extraction": {
    "method": "trafilatura",
    "page_count": null,
    "quality": 1.0,
    "raw_content_sha256": "17d86af518bb40ad0333b365d69e5be533689917293d321b5986de4f000ab116",
    "raw_path": "data/raw/district-botanica/17d86af518bb40ad0333b365d69e5be533689917293d321b5986de4f000ab116.html",
    "structure_path": null
  },
  "language": "ro",
  "retrieved_at": "2026-09-25T17:34:39.874733+00:00",
  "source_url": "https://botanica.md/1270",
  "title": "Raport",
  "version_id": "ver_330d31db_0ef19071ed14"
}
