{
  "category": "district_administration",
  "content": "# Ședința operativă a serviciilor Primăriei Chișinău din 2 decembrie 2024\n\n***\n\nDespre activităţile zilnice ale Primăriei Chişinău, informaţi-vă pe canalul de teleg...ram\n\nhttps://t.me/Primaria_Chisinau\n\nwww.chisinau.md\n\n@followers\n",
  "content_sha256": "9f291baa16a68fef4bcc111ac12f0d1cc46dcfe8d44508001282182f9ed05f12",
  "document_date": null,
  "document_id": "doc_dc6592fa26ef5623f119",
  "document_type": "html",
  "effective_from": null,
  "effective_to": null,
  "extraction": {
    "method": "trafilatura",
    "page_count": null,
    "quality": 1.0,
    "raw_content_sha256": "743142a67bc2afd4376b521a1440e80c296c618a4668d28bc519e2912c274fc3",
    "raw_path": "data/raw/district-botanica/743142a67bc2afd4376b521a1440e80c296c618a4668d28bc519e2912c274fc3.html",
    "structure_path": null
  },
  "language": "ro",
  "retrieved_at": "2026-09-25T17:24:51.812470+00:00",
  "source_url": "https://botanica.md/794",
  "title": "Ședința operativă a serviciilor Primăriei Chișinău din 2 decembrie 2024",
  "version_id": "ver_dc6592fa_9f291baa16a6"
}
