{
  "category": "education",
  "content": "# Ordine\n\nTotal ordine: **284**\n\n- [Ordin nr. 01/1-7/1061 din 30.07.2026 Cu privire la desfășurarea reuniunilor metodice privind organizarea procesului educațional în învățământul general, anul de studii 2026-2027](https://chisinauedu.dgets.md/storage/orders/1785412231_reuniuni-metod.pdf)\n  - [Anexă - Reuniuni_metod.PDF PDF • 224.9 KB](https://chisinauedu.dgets.md/storage/orders/attachments/1785412231_reuniuni-metod_j5em51.pdf)\n- [Ordin nr. 01/1-7/1060 din 30.07.2026 Organizarea examenelor naționale de absolvire a gimnaziului, sesiune suplimentară, august 2026](https://chisinauedu.dgets.md/storage/orders/1785412303_ord-1060-org-exam-august-2026.pdf)\n- [Ordin nr. 1511 din 28.07.2026 Cu privire la conferirea/confirmarea gradelor didactice](https://chisinauedu.dgets.md/storage/orders/1786712707_ordinul-mec-nr1511-cu-privire-la-conferirea-confirmarea-gradelor-didactice.pdf)\n  - [Anexă - Anexa nr.2 la Ordinul nr.1511_Confer_grad_did_unu.pdf PDF • 9.6 MB](https://chisinauedu.dgets.md/storage/orders/attachments/1786712707_anexa-nr2-la-ordinul-nr1511-confer-grad-did-unu_Fm0BXi.pdf)\n  - [Anexă - Anexa nr.1 la Ordinul nr.1511_Conferirea grad_did_superior .pdf PDF • 4.5 MB](https://chisinauedu.dgets.md/storage/orders/attachments/1786712708_anexa-nr1-la-ordinul-nr1511-conferirea-grad-did-superior_ufUEwq.pdf)\n- [Ordin nr. 1512 din 28.07.2026 din 28.07.2026 Cu privire la conferirea/confirmarea gradelor manageriale ordinul 1512 din 28.07.2026](https://chisinauedu.dgets.md/storage/orders/1786713648_ordinul-mec-nr-1512.pdf)\n- [Ordin nr. 01/1-7/1046 din 23.07.2026 Ordin Cu privire la conferirea/confirmarea gradelor didactice](https://chisinauedu.dgets.md/storage/orders/1784892279_ordin-cu-privire-la-conferirea-confirmarea-gradelor-didactice-01-1-7-1046-din-230726.pdf)\n  - [Anexă - Anexa 2 cu privire la confirmarea gradellor didactice doi 01-1-7-1046 din 23.07.26.pdf PDF • 19.5 MB](https://chisinauedu.dgets.md/storage/orders/attachments/1784892279_anexa-2-cu-privire-la-confirmarea-gradellor-didactice-doi-01-1-7-1046-din-230726_KN4frA.pdf)\n  - [Anexă - 26_Anexa 3_confirm_did_unu_1046.pdf PDF • 11.0 MB](https://chisinauedu.dgets.md/storage/orders/attachments/1784893383_26-anexa-3-confirm-did-unu-1046_wG7zSJ.pdf)\n  - [Anexă - 26_Anexa 4_confirm_super_1046.pdf PDF • 6.3 MB](https://chisinauedu.dgets.md/storage/orders/attachments/1784893383_26-anexa-4-confirm-super-1046_Av7cPy.pdf)\n  - [Anexă - 26_Anexa 1_confer_ gr_ did_doi_1046 din 23.07.26.pdf PDF • 14.5 MB](https://chisinauedu.dgets.md/storage/orders/attachments/1784893383_26-anexa-1-confer-gr-did-doi-1046-din-230726_aIl4TA.pdf)\n- [Ordin nr. 01/1-7/1047 din 23.07.2026 Cu privire la conferirea/confirmarea gradelor manageriale](https://chisinauedu.dgets.md/storage/orders/1784893236_ordin-cu-privire-la-conferirea-confirmarea-gradelor-manageriale-01-1-7-1047-din-230726.pdf)\n- [Ordin nr. 01/1-7/1020 din 03.07.2026 Cu privire la organizarea examenelor naționale de absolvire, sesiunea suplimentară](https://chisinauedu.dgets.md/storage/orders/1783069954_ordin-sesiunea-suplimentara-2026.pdf)\n- [Ordin nr. 01/1-7/1021 din 03.07.2026 Cu privire la evaluarea nivelului de pregătire a instituțiilor de învățământ general către anul de studii 2026-2027](https://chisinauedu.dgets.md/storage/orders/1783081357_ordin-evaluarea-instituiilor.pdf)\n- [Ordin nr. 01/1-7/1013 din 30.06.2026 Cu privire Ia totalizarea Conferinței Transfrontaliere ,,Educație Online fără Hotare: Conectam comunități, Cultivăm Valori UTNESCO\", ediția 2026](https://chisinauedu.dgets.md/storage/orders/1785391048_ordin-totalizare-conf-transfr-25-iunie-2026.pdf)\n  - [Anexă - Anexa 3_Postere_Conf_Transfr_25 iunie 2026.PDF PDF • 889.6 KB](https://chisinauedu.dgets.md/storage/orders/attachments/1785391048_anexa-3-postere-conf-transfr-25-iunie-2026_MqRliC.pdf)\n  - [Anexă - Anexa 2_Prezentatori_Conf_Trasfr_25 iunie 2026.PDF PDF • 88.0 KB](https://chisinauedu.dgets.md/storage/orders/attachments/1785391048_anexa-2-prezentatori-conf-trasfr-25-iunie-2026_Btjk7a.pdf)\n  - [Anexă - Anexa 1_Participanti_Conf_Transfr_25 iunie 2026 .PDF PDF • 1.9 MB](https://chisinauedu.dgets.md/storage/orders/attachments/1785391048_anexa-1-participanti-conf-transfr-25-iunie-2026_ieG1ss.pdf)\n- [Ordin nr. 01/1-7/967 din 12.06.2026 Cu privire la organizarea Programului de dezvoltare profesională dedicat elaborării fișelor digitale interactive în baza noilor manuale și caiete la limba engleză\" II (nivel A1-A2)](https://chisinauedu.dgets.md/storage/orders/1781697720_ordinanexa-1-fise-digitale-engleza-ii-1.pdf)\n  - [Anexă - LISTA_CERTIFICATE_DIGITALIZARE_MANUALE_DE_ENGLEZA_c40c4772_38d4.pdf PDF • 136.8 KB](https://chisinauedu.dgets.md/storage/orders/attachments/1788957248_lista-certificate-digitalizare-manuale-de-engleza-c40c4772-38d4_rDJbP0.pdf)\n",
  "content_sha256": "459801f10980c7fe6476f51dd4b67183dd3d69722954355747d067747f11ecfb",
  "document_date": null,
  "document_id": "doc_3c700999cf3981a91d6c",
  "document_type": "html",
  "effective_from": null,
  "effective_to": null,
  "extraction": {
    "method": "dom-markdown",
    "page_count": null,
    "quality": 1.0,
    "raw_content_sha256": "34e420f3397df2de3f99c7499c394d486d1438e2868be18802e692655983bc5d",
    "raw_path": "data/raw/chisinau-education-ordine/34e420f3397df2de3f99c7499c394d486d1438e2868be18802e692655983bc5d.html",
    "structure_path": null
  },
  "language": "ro",
  "retrieved_at": "2026-09-26T06:42:09.534733+00:00",
  "source_url": "https://chisinauedu.dgets.md/ordine",
  "title": "Ordine",
  "version_id": "ver_3c700999_459801f10980"
}
