{
  "category": "district_administration",
  "content": "Festivalul „Zilele Chișinăului la Buzău” organizat de către Primăria Chișinău, Pretura sectorului Botanica în parteneriat cu Consiliul Județean Buzău se desfășoară în perioada 16-18 septembrie, unde a avut loc un concert în aer liber susținut de artiști valoroși de la Chișinău, Orchestra de muzică populară „Fraţii Advahov”, Ansamblul de muzică uşoară „Alex Calancea Band”, Surorile Osoianu, Mihai Ciobanu, Zinaida Julea, dar și alți oameni deosebiți prin talentul său.\n\nDe asemenea este organizată o expoziție a meșterilor populari din diferite zone ale Moldovei.\n\nȘi pe parcursul zilelor următoare va continua programul în cadrul Festivalului „Zilele Chișinăului la Buzău”, cu târguri și lansare de carte.\n\nLa final vor evolua pe scenă Ansamblul etnofolcloric „Plăieșii” și Ansamblul de muzică ușoară „Vali Boghean Band”.\n\nAstăzi, în cadrul festivalului a fost inaugurată expoziția „Un tandem remarcabil: Primarul Carol Schmidt și arhitectul Alexandru Bernardazzi”, dedicată aniversării a 175 de ani de la nașterea Primarului Carol Schmidt și 190 de ani de nașterea arhitectului Alexandru Bernardazzi, cu 18 panouri și 150 de fotografii și documente ce reflectă istoria dezvoltării infrastructurii și arhitecturii Chișinăului la acea perioadă. Evenimentul organizat de Direcția Cultură a Primăriei și Muzeul de Istorie a Orașului Chișinău se desfășoară în perioada 17-18 septembrie, la sediul Muzeului Judeţean Buzău.\n\nAstfel, locuitorii orașului și județului gazdă au avut posibilitatea să viziteze expoziția și să afle mai multe informații despre orașul Chișinău și despre personalitățile care au contribuit la dezvoltarea acestuia. La deschidere a participat Pretorul de Botanica, Diana Guba, Șefa Direcției Cultură, Valentina Volontir, Președintele Consiliului Județean Buzău, Petre Emanoil Neagu, șeful Muzeului Județean Buzău, Daniel Costache etc.\n\nLa finalul zilei vor evolua pe scenă Ansamblul etnofolcloric ,,Plăieșii\" și Ansamblul de muzică ușoară ,,Vali Boghean Band”, care sunt așteptați cu mare drag.\n",
  "content_sha256": "785a54a4b817b7c34b99a3bb13de7f7721ccd696c92cc9905b7c2bd84107c924",
  "document_date": null,
  "document_id": "doc_ea7ebb64399c8a3ceaf6",
  "document_type": "html",
  "effective_from": null,
  "effective_to": null,
  "extraction": {
    "method": "trafilatura",
    "page_count": null,
    "quality": 1.0,
    "raw_content_sha256": "261795e604b5f5ae97d008179d760fbc922048cdf69bcbe35032c346fd67fa90",
    "raw_path": "data/raw/district-botanica/261795e604b5f5ae97d008179d760fbc922048cdf69bcbe35032c346fd67fa90.html",
    "structure_path": null
  },
  "language": "ro",
  "retrieved_at": "2026-09-25T17:44:52.851741+00:00",
  "source_url": "https://botanica.md/festivalul-,,zilele-chi%C8%99in%C4%83ului-la-buz%C4%83u",
  "title": "Festivalul ,,Zilele Chișinăului la Buzău\"!",
  "version_id": "ver_ea7ebb64_785a54a4b817"
}
