{
  "category": "education",
  "content": "# Program de dezvoltare a creativității copiilor „ProLogic”\n\n###### Utilizatorii serviciului vor beneficia de o gamă largă de jocuri inteligente (logică, memorie, strategie, îndemnare și cultură generală).Vor dezvolta atenția, răbdarea, memoria, logica, vor cultiva erudiția, creativitatea, spiritul de echipă; vor spori gândirea logică și strategică\n\n##### Opțiune preț\n\nGratuit\n\n##### Modalitate de desfășurare\n\nCu prezența fizică\n\n##### Orar\n\nJoi, ora 14:00\n\n##### Vârsta\n\n7 ani - 12 ani\n\n##### Adresa\n\nStr.Decebal, 91\n\n#### Instituția:\n\n###### Biblioteca „Ştefan cel Mare”, Filiala Bibliotecii Municipale „B.P. Hasdeu\"\n\n##### Email\n\nstefanmare.hasdeu@gmail.com\n\n##### Telefon\n\n022-55-14-83\n\n#### Formular de înregistrare\n\nNume Prenume Email Telefon TRANSMITE\n",
  "content_sha256": "483ecda2a7c896fe8bacdc05d769e1c3d9c4e5e219b528721906287cafe34cc1",
  "document_date": null,
  "document_id": "doc_1e3c6d6fe86a8105c0a1",
  "document_type": "html",
  "effective_from": null,
  "effective_to": null,
  "extraction": {
    "method": "dom-markdown",
    "page_count": null,
    "quality": 1.0,
    "raw_content_sha256": "ce8ab4e0efa8e51f1a41d6ef68a47bf031c921403b6527b71879279fcc4edcd9",
    "raw_path": "data/raw/extrascolar-activities/ce8ab4e0efa8e51f1a41d6ef68a47bf031c921403b6527b71879279fcc4edcd9.html",
    "structure_path": null
  },
  "language": "ro",
  "retrieved_at": "2026-09-25T22:03:54.217683+00:00",
  "source_url": "https://extrascolar.md/activity/program-de-dezvoltare-a-creativitatii-copiilor-prologic123",
  "title": "Program de dezvoltare a creativității copiilor „ProLogic”",
  "version_id": "ver_1e3c6d6f_483ecda2a7c8"
}
