{
  "category": "district_administration",
  "content": "Join our subscribers list to get the latest news, updates and special offers directly in your inbox\n",
  "content_sha256": "81fd09ad78bcb29d75c638a4df169837b024086220ce7ece80f1336bce260aff",
  "document_date": null,
  "document_id": "doc_3d8f9b8ac0037586d7e5",
  "document_type": "html",
  "effective_from": null,
  "effective_to": null,
  "extraction": {
    "method": "trafilatura",
    "page_count": null,
    "quality": 1.0,
    "raw_content_sha256": "d5b6dc28b872010a52595b75189355cc7f411682b908d32608bc461022852a7f",
    "raw_path": "data/raw/district-botanica/d5b6dc28b872010a52595b75189355cc7f411682b908d32608bc461022852a7f.html",
    "structure_path": null
  },
  "language": "ro",
  "retrieved_at": "2026-09-25T17:50:57.667860+00:00",
  "source_url": "https://botanica.md/institutii",
  "title": "INSTITUŢII",
  "version_id": "ver_3d8f9b8a_81fd09ad78bc"
}
