{
  "category": "district_administration",
  "content": "# Raportul de activitate al Preturii sectorului Botanica pentru semestrul I, al anului 2026\n",
  "content_sha256": "0e5215af9e17a491d3770a753687cfe5eff0861434f5c0ace0660fbefde01e99",
  "document_date": null,
  "document_id": "doc_d1b43d1665eb9f14e104",
  "document_type": "html",
  "effective_from": null,
  "effective_to": null,
  "extraction": {
    "method": "trafilatura",
    "page_count": null,
    "quality": 1.0,
    "raw_content_sha256": "6e965c7599e6d282c51a23083ebfa0ec897f84aa9c06b1ba4b917366651b3c29",
    "raw_path": "data/raw/district-botanica/6e965c7599e6d282c51a23083ebfa0ec897f84aa9c06b1ba4b917366651b3c29.html",
    "structure_path": null
  },
  "language": "ro",
  "retrieved_at": "2026-09-25T17:34:31.638354+00:00",
  "source_url": "https://botanica.md/1280",
  "title": "Raportul de activitate al Preturii sectorului Botanica pentru semestrul I, al anului 2026",
  "version_id": "ver_d1b43d16_0e5215af9e17"
}
