{
  "category": "district_administration",
  "content": "Pretura sectorului Botanica informează că în temeiul hotărârii nr. 51 din 19.01.2022 a Comisiei extraordinare de sănătate publică a municipiului Chişinău, hotărârii nr. 2 din 20.01.2022 a Comisiei naţionale extraordinare de sănătate publică în scopul prevenirii răspândirii infecţiei CODIV-19 pe teritoriul municipiului Chişinău este sistată audiența.\n\nAstfel, în perioada: 24 ianuarie - 20 februarie, a.c., accesul tuturor vizitatorilor în clădire este restricționat!\n\nDepunerea cererilor și eliberarea actelor solicitate de cetățeni se va efectua prin intermediul boxei din holul Preturii sau adresei de email: pretura.botanica@pmc.md, ori prin poștă, pe adresa: MD 2043, mun. Chișinău, str. Teilor, 10.\n",
  "content_sha256": "1ef095afdf4b2299dcaf2b5d4bd0f93fecf765f28f6cc9fa602ce2f4415abf88",
  "document_date": null,
  "document_id": "doc_1f772648ada43924de1c",
  "document_type": "html",
  "effective_from": null,
  "effective_to": null,
  "extraction": {
    "method": "trafilatura",
    "page_count": null,
    "quality": 1.0,
    "raw_content_sha256": "ce0110b401faed68716245e594a03b0eeb9f7ff0a692c96de411f8f5b34d4f8e",
    "raw_path": "data/raw/district-botanica/ce0110b401faed68716245e594a03b0eeb9f7ff0a692c96de411f8f5b34d4f8e.html",
    "structure_path": null
  },
  "language": "ro",
  "retrieved_at": "2026-09-25T17:44:05.380273+00:00",
  "source_url": "https://botanica.md/anun%C8%9A-de-restric%C8%9Aionare-a-acesului-vizitatorilor-%C3%8En-incinta-preturii",
  "title": "ANUNȚ DE RESTRICȚIONARE A ACESULUI VIZITATORILOR ÎN INCINTA PRETURII",
  "version_id": "ver_1f772648_1ef095afdf4b"
}
