{
  "category": "district_administration",
  "content": "# Continuă demontarea gheretelor în sectorul Botanica\n\nAstfel, astăzi, 09 martie 2021, în conformitate cu prevederile dispoziției Pretorului sectorului Botanica au fost demolate gheretele din str. N. Zelinski, 5/1 și bd. Traian, 19/2. Lucrările de demontare și evacuare au fost asigurate de către angajații Întreprinderii Municipale pentru Servicii Locative Botanica, iar ordinea publică a fost asigurată de către angajații Inspectoratului de Poliție Botanica.\n",
  "content_sha256": "30e053b2693adaed10c762ca12eb744f2eaee0a31dff27c8d147627e17388f4f",
  "document_date": null,
  "document_id": "doc_2e6c63f1fe89823ca49a",
  "document_type": "html",
  "effective_from": null,
  "effective_to": null,
  "extraction": {
    "method": "trafilatura",
    "page_count": null,
    "quality": 1.0,
    "raw_content_sha256": "883610581850202dee4fcd42f6e0f22fe77b82b8c9736a255d8934b2d3a06a91",
    "raw_path": "data/raw/district-botanica/883610581850202dee4fcd42f6e0f22fe77b82b8c9736a255d8934b2d3a06a91.html",
    "structure_path": null
  },
  "language": "ro",
  "retrieved_at": "2026-09-25T18:10:00+00:00",
  "source_url": "https://botanica.md/continua-demontarea-gheretelor-in-sectorul-botanica",
  "title": "Continuă demontarea gheretelor în sectorul Botanica",
  "version_id": "ver_2e6c63f1_30e053b2693a"
}
