{
  "category": "education",
  "content": "# Weekend la Centrul Municipal de Tineret pentru Tineri\n\n###### Dacă nu v-ați făcut încă planuri pentru weekend, atunci noi vă venim în întâmpinare cu niște activități grozave! În caz că te-ai gândit vreodată să devii unul dintre jurnaliștii de succes, avem activitatea perfectă pentru tine! Sâmbătă organizăm ,,Career talk cu un jurnalist”, tinerii/ele vor putea pătrunde în lumea televiziunii și vor putea afla despre secretele din spatele micilor ecrane. Cu siguranță vor primi sfaturi utile privind meseria dată, și ce perspective de viitor are. Duminică, se va organiza activitatea ,,Street art”, unde vă puteți expune creativitatea urbană pe planșe, cu ajutorul vopselelor spray. La final va fi o expoziție cu toate planșele pline de idei originale. Nu ezita să vii și să demonstrezi cât de creativ/ă ești. După fiecare activitate participanții/tele vor avea ocazia să-și petreacă timpul distractiv, jucând volei, badminton,tenis de masă, jocuri de societate( Mafia, Catan, 5 Minute, etc).\n\n##### Opțiune preț\n\nGratuit\n\n##### Modalitate de desfășurare\n\nCu prezența fizică\n\n##### Orar\n\nSâmbăta - Duminica\n\n##### Vârsta\n\n14 ani - 35 ani\n\n##### Adresa\n\nStr. Petru Zadnipru 3/2\n\n#### Instituția:\n\n###### Centrul Municipal de Tineret Chișinău\n\n##### Email\n\ncentru.chisinau@gmail.com\n\n##### Telefon\n\n022 482 420\n\n[Link de înregistrare](https://forms.gle/uBRN4rBdBQfggsRH9)\n",
  "content_sha256": "b779c0f3860f1cf04aea0842bcee747fb06158ee2f6351ca9203948c169f5815",
  "document_date": null,
  "document_id": "doc_b8a670903156eec47748",
  "document_type": "html",
  "effective_from": null,
  "effective_to": null,
  "extraction": {
    "method": "dom-markdown",
    "page_count": null,
    "quality": 1.0,
    "raw_content_sha256": "68358aa3f881232b7b9652efef6b428f1716315b24a2d66efa022d5c67c96f7a",
    "raw_path": "data/raw/extrascolar-activities/68358aa3f881232b7b9652efef6b428f1716315b24a2d66efa022d5c67c96f7a.html",
    "structure_path": null
  },
  "language": "ro",
  "retrieved_at": "2026-09-25T22:03:03.973600+00:00",
  "source_url": "https://extrascolar.md/activity/weekend-la-centrul-municipal-de-tineret-pentru-tineri52",
  "title": "Weekend la Centrul Municipal de Tineret pentru Tineri",
  "version_id": "ver_b8a67090_b779c0f3860f"
}
